{"schema_version":"mulgae-mcp-tool-result.v1","tool":"inspect_review","request_id":"i_019f596a-cfe4-7c9c-b82e-7149158243bb","outcome":"success","data":{"run_id":"r_019f596a-cfe4-7c9c-b82e-7149158243bb","capture_availability":"capture_identity_unavailable","capture_identity":"","publication_receipt":"sha256:2222222222222222222222222222222222222222222222222222222222222222","capabilities":{"capture_identity":"v1","inspection":"v1"},"finding_count":0,"returned_count":0,"findings":[]},"error":null}
